{
  "$schema": "../scenes.schema.json",
  "schemaVersion": 1,
  "conversationId": "t7-50",
  "status": "ready",
  "enabled": true,
  "imagesApproved": true,
  "timingReviewed": true,
  "hotspotsReviewed": true,
  "audio": {
    "src": "../../audio/E26-T07-50-52.mp3",
    "timebase": "source-seconds",
    "dialogueStart": 7.02,
    "dialogueEnd": 38.28
  },
  "transcriptSrc": "transcript.json",
  "images": [
    {
      "id": "photo-1",
      "src": "images/scene-01.png",
      "alt": "Ảnh minh họa hội thoại Test 7 câu 50–52, cảnh 1",
      "mediaType": "photograph",
      "focalPoint": {
        "x": 0.5,
        "y": 0.5
      }
    },
    {
      "id": "photo-2",
      "src": "images/scene-02.png",
      "alt": "Ảnh minh họa hội thoại Test 7 câu 50–52, cảnh 2",
      "mediaType": "photograph",
      "focalPoint": {
        "x": 0.5,
        "y": 0.5
      }
    },
    {
      "id": "photo-3",
      "src": "images/scene-03.png",
      "alt": "Ảnh minh họa hội thoại Test 7 câu 50–52, cảnh 3",
      "mediaType": "photograph",
      "focalPoint": {
        "x": 0.5,
        "y": 0.5
      }
    },
    {
      "id": "photo-4",
      "src": "images/scene-04.png",
      "alt": "Ảnh minh họa hội thoại Test 7 câu 50–52, cảnh 4",
      "mediaType": "photograph",
      "focalPoint": {
        "x": 0.5,
        "y": 0.5
      }
    }
  ],
  "scenes": [
    {
      "id": "scene-1",
      "imageId": "photo-1",
      "start": 7.02,
      "end": 14.4,
      "transition": {
        "type": "fade",
        "duration": 0.45
      },
      "motion": {
        "from": {
          "x": 0.5,
          "y": 0.5,
          "scale": 1.01
        },
        "to": {
          "x": 0.512,
          "y": 0.495,
          "scale": 1.045
        }
      },
      "hotspots": [
        {
          "id": "spot-1-1",
          "vocabularyId": "vocab-1-1",
          "label": "menu design",
          "x": 0.2,
          "y": 0.69,
          "width": 0.52,
          "height": 0.27,
          "utteranceIds": [
            "t7-50-u01"
          ]
        }
      ],
      "characters": [
        {
          "speaker": "M1",
          "x": 0.01,
          "y": 0.03,
          "width": 0.3,
          "height": 0.9
        },
        {
          "speaker": "M2",
          "x": 0.32,
          "y": 0.03,
          "width": 0.3,
          "height": 0.9
        },
        {
          "speaker": "W",
          "x": 0.68,
          "y": 0.03,
          "width": 0.3,
          "height": 0.9
        }
      ]
    },
    {
      "id": "scene-2",
      "imageId": "photo-2",
      "start": 14.4,
      "end": 20.49,
      "transition": {
        "type": "fade",
        "duration": 0.45
      },
      "motion": {
        "from": {
          "x": 0.5,
          "y": 0.5,
          "scale": 1.01
        },
        "to": {
          "x": 0.488,
          "y": 0.495,
          "scale": 1.045
        }
      },
      "hotspots": [
        {
          "id": "spot-2-1",
          "vocabularyId": "vocab-2-1",
          "label": "dolphin",
          "x": 0.54,
          "y": 0.47,
          "width": 0.21,
          "height": 0.35,
          "utteranceIds": [
            "t7-50-u03"
          ]
        }
      ],
      "characters": [
        {
          "speaker": "M1",
          "x": 0.01,
          "y": 0.03,
          "width": 0.3,
          "height": 0.9
        },
        {
          "speaker": "M2",
          "x": 0.32,
          "y": 0.03,
          "width": 0.3,
          "height": 0.9
        },
        {
          "speaker": "W",
          "x": 0.68,
          "y": 0.03,
          "width": 0.3,
          "height": 0.9
        }
      ]
    },
    {
      "id": "scene-3",
      "imageId": "photo-3",
      "start": 20.49,
      "end": 31.02,
      "transition": {
        "type": "fade",
        "duration": 0.45
      },
      "motion": {
        "from": {
          "x": 0.5,
          "y": 0.5,
          "scale": 1.01
        },
        "to": {
          "x": 0.512,
          "y": 0.495,
          "scale": 1.045
        }
      },
      "hotspots": [
        {
          "id": "spot-3-1",
          "vocabularyId": "vocab-3-1",
          "label": "beach",
          "x": 0.57,
          "y": 0.01,
          "width": 0.42,
          "height": 0.43,
          "utteranceIds": [
            "t7-50-u05"
          ]
        }
      ],
      "characters": [
        {
          "speaker": "M1",
          "x": 0.01,
          "y": 0.03,
          "width": 0.3,
          "height": 0.9
        },
        {
          "speaker": "M2",
          "x": 0.32,
          "y": 0.03,
          "width": 0.3,
          "height": 0.9
        },
        {
          "speaker": "W",
          "x": 0.68,
          "y": 0.03,
          "width": 0.3,
          "height": 0.9
        }
      ]
    },
    {
      "id": "scene-4",
      "imageId": "photo-4",
      "start": 31.02,
      "end": 38.28,
      "transition": {
        "type": "fade",
        "duration": 0.45
      },
      "motion": {
        "from": {
          "x": 0.5,
          "y": 0.5,
          "scale": 1.01
        },
        "to": {
          "x": 0.488,
          "y": 0.495,
          "scale": 1.045
        }
      },
      "hotspots": [],
      "characters": [
        {
          "speaker": "M1",
          "x": 0.01,
          "y": 0.03,
          "width": 0.3,
          "height": 0.9
        },
        {
          "speaker": "M2",
          "x": 0.32,
          "y": 0.03,
          "width": 0.3,
          "height": 0.9
        },
        {
          "speaker": "W",
          "x": 0.68,
          "y": 0.03,
          "width": 0.3,
          "height": 0.9
        }
      ]
    }
  ],
  "vocabulary": [
    {
      "id": "vocab-1-1",
      "en": "menu design",
      "vi": "thiết kế thực đơn",
      "pronunciation": {
        "kind": "tts",
        "lang": "en-US"
      }
    },
    {
      "id": "vocab-2-1",
      "en": "dolphin",
      "vi": "cá heo",
      "pronunciation": {
        "kind": "tts",
        "lang": "en-US"
      }
    },
    {
      "id": "vocab-3-1",
      "en": "beach",
      "vi": "bãi biển",
      "pronunciation": {
        "kind": "tts",
        "lang": "en-US"
      }
    }
  ],
  "speakers": [
    {
      "id": "M1",
      "label": "Người nam",
      "portrait": {
        "imageId": "photo-1",
        "x": 0.04,
        "y": 0.05,
        "width": 0.24,
        "height": 0.42
      }
    },
    {
      "id": "M2",
      "label": "Người nam",
      "portrait": {
        "imageId": "photo-1",
        "x": 0.35,
        "y": 0.05,
        "width": 0.24,
        "height": 0.42
      }
    },
    {
      "id": "W",
      "label": "Người nữ",
      "portrait": {
        "imageId": "photo-1",
        "x": 0.71,
        "y": 0.05,
        "width": 0.24,
        "height": 0.42
      }
    }
  ],
  "missing": []
}
