{
  "$schema": "../scenes.schema.json",
  "schemaVersion": 1,
  "conversationId": "t8-47",
  "status": "ready",
  "enabled": true,
  "imagesApproved": true,
  "timingReviewed": true,
  "hotspotsReviewed": true,
  "audio": {
    "src": "../../audio/E26-T08-47-49.mp3",
    "timebase": "source-seconds",
    "dialogueStart": 6.12,
    "dialogueEnd": 28.5
  },
  "transcriptSrc": "transcript.json",
  "images": [
    {
      "id": "photo-1",
      "src": "images/scene-01.png",
      "alt": "Ảnh minh họa hội thoại Test 8 câu 47–49, cảnh 1",
      "mediaType": "photograph",
      "focalPoint": {
        "x": 0.5,
        "y": 0.5
      }
    },
    {
      "id": "photo-2",
      "src": "images/scene-02.png",
      "alt": "Ảnh minh họa hội thoại Test 8 câu 47–49, cảnh 2",
      "mediaType": "photograph",
      "focalPoint": {
        "x": 0.5,
        "y": 0.5
      }
    },
    {
      "id": "photo-3",
      "src": "images/scene-03.png",
      "alt": "Ảnh minh họa hội thoại Test 8 câu 47–49, cảnh 3",
      "mediaType": "photograph",
      "focalPoint": {
        "x": 0.5,
        "y": 0.5
      }
    },
    {
      "id": "photo-4",
      "src": "images/scene-04.png",
      "alt": "Ảnh minh họa hội thoại Test 8 câu 47–49, cảnh 4",
      "mediaType": "photograph",
      "focalPoint": {
        "x": 0.5,
        "y": 0.5
      }
    }
  ],
  "scenes": [
    {
      "id": "scene-1",
      "imageId": "photo-1",
      "start": 6.12,
      "end": 11.91,
      "transition": {
        "type": "fade",
        "duration": 0.45
      },
      "motion": {
        "from": {
          "x": 0.5,
          "y": 0.5,
          "scale": 1.01
        },
        "to": {
          "x": 0.512,
          "y": 0.495,
          "scale": 1.045
        }
      },
      "hotspots": [
        {
          "id": "spot-1-1",
          "vocabularyId": "vocab-1-1",
          "label": "script",
          "x": 0.31,
          "y": 0.48,
          "width": 0.3,
          "height": 0.35,
          "utteranceIds": [
            "t8-47-u01"
          ]
        }
      ],
      "characters": [
        {
          "speaker": "M",
          "x": 0.02,
          "y": 0.025,
          "width": 0.44,
          "height": 0.9
        },
        {
          "speaker": "W",
          "x": 0.56,
          "y": 0.025,
          "width": 0.42,
          "height": 0.91
        }
      ]
    },
    {
      "id": "scene-2",
      "imageId": "photo-2",
      "start": 11.91,
      "end": 19.92,
      "transition": {
        "type": "fade",
        "duration": 0.45
      },
      "motion": {
        "from": {
          "x": 0.5,
          "y": 0.5,
          "scale": 1.01
        },
        "to": {
          "x": 0.488,
          "y": 0.495,
          "scale": 1.045
        }
      },
      "hotspots": [
        {
          "id": "spot-2-1",
          "vocabularyId": "vocab-2-1",
          "label": "storyboards",
          "x": 0.28,
          "y": 0.06,
          "width": 0.49,
          "height": 0.57,
          "utteranceIds": [
            "t8-47-u02"
          ]
        }
      ],
      "characters": [
        {
          "speaker": "M",
          "x": 0.02,
          "y": 0.025,
          "width": 0.44,
          "height": 0.9
        },
        {
          "speaker": "W",
          "x": 0.56,
          "y": 0.025,
          "width": 0.42,
          "height": 0.91
        }
      ]
    },
    {
      "id": "scene-3",
      "imageId": "photo-3",
      "start": 19.92,
      "end": 24.09,
      "transition": {
        "type": "fade",
        "duration": 0.45
      },
      "motion": {
        "from": {
          "x": 0.5,
          "y": 0.5,
          "scale": 1.01
        },
        "to": {
          "x": 0.512,
          "y": 0.495,
          "scale": 1.045
        }
      },
      "hotspots": [],
      "characters": [
        {
          "speaker": "M",
          "x": 0.02,
          "y": 0.025,
          "width": 0.44,
          "height": 0.9
        },
        {
          "speaker": "W",
          "x": 0.56,
          "y": 0.025,
          "width": 0.42,
          "height": 0.91
        }
      ]
    },
    {
      "id": "scene-4",
      "imageId": "photo-4",
      "start": 24.09,
      "end": 28.5,
      "transition": {
        "type": "fade",
        "duration": 0.45
      },
      "motion": {
        "from": {
          "x": 0.5,
          "y": 0.5,
          "scale": 1.01
        },
        "to": {
          "x": 0.488,
          "y": 0.495,
          "scale": 1.045
        }
      },
      "hotspots": [
        {
          "id": "spot-4-1",
          "vocabularyId": "vocab-4-1",
          "label": "script",
          "x": 0.32,
          "y": 0.52,
          "width": 0.33,
          "height": 0.33,
          "utteranceIds": [
            "t8-47-u06"
          ]
        }
      ],
      "characters": [
        {
          "speaker": "M",
          "x": 0.02,
          "y": 0.025,
          "width": 0.44,
          "height": 0.9
        },
        {
          "speaker": "W",
          "x": 0.56,
          "y": 0.025,
          "width": 0.42,
          "height": 0.91
        }
      ]
    }
  ],
  "vocabulary": [
    {
      "id": "vocab-1-1",
      "en": "script",
      "vi": "kịch bản",
      "pronunciation": {
        "kind": "tts",
        "lang": "en-US"
      }
    },
    {
      "id": "vocab-2-1",
      "en": "storyboards",
      "vi": "bảng phân cảnh",
      "pronunciation": {
        "kind": "tts",
        "lang": "en-US"
      }
    },
    {
      "id": "vocab-4-1",
      "en": "script",
      "vi": "kịch bản",
      "pronunciation": {
        "kind": "tts",
        "lang": "en-US"
      }
    }
  ],
  "speakers": [
    {
      "id": "M",
      "label": "Người nam",
      "portrait": {
        "imageId": "photo-1",
        "x": 0.12,
        "y": 0.045,
        "width": 0.24,
        "height": 0.42
      }
    },
    {
      "id": "W",
      "label": "Người nữ",
      "portrait": {
        "imageId": "photo-1",
        "x": 0.65,
        "y": 0.045,
        "width": 0.24,
        "height": 0.42
      }
    }
  ],
  "missing": []
}
