{
  "$schema": "../scenes.schema.json",
  "schemaVersion": 1,
  "conversationId": "t8-50",
  "status": "ready",
  "enabled": true,
  "imagesApproved": true,
  "timingReviewed": true,
  "hotspotsReviewed": true,
  "audio": {
    "src": "../../audio/E26-T08-50-52.mp3",
    "timebase": "source-seconds",
    "dialogueStart": 7.05,
    "dialogueEnd": 51.18
  },
  "transcriptSrc": "transcript.json",
  "images": [
    {
      "id": "photo-1",
      "src": "images/scene-01.png",
      "alt": "Ảnh minh họa hội thoại Test 8 câu 50–52, cảnh 1",
      "mediaType": "photograph",
      "focalPoint": {
        "x": 0.5,
        "y": 0.5
      }
    },
    {
      "id": "photo-2",
      "src": "images/scene-02.png",
      "alt": "Ảnh minh họa hội thoại Test 8 câu 50–52, cảnh 2",
      "mediaType": "photograph",
      "focalPoint": {
        "x": 0.5,
        "y": 0.5
      }
    },
    {
      "id": "photo-3",
      "src": "images/scene-03.png",
      "alt": "Ảnh minh họa hội thoại Test 8 câu 50–52, cảnh 3",
      "mediaType": "photograph",
      "focalPoint": {
        "x": 0.5,
        "y": 0.5
      }
    },
    {
      "id": "photo-4",
      "src": "images/scene-04.png",
      "alt": "Ảnh minh họa hội thoại Test 8 câu 50–52, cảnh 4",
      "mediaType": "photograph",
      "focalPoint": {
        "x": 0.5,
        "y": 0.5
      }
    }
  ],
  "scenes": [
    {
      "id": "scene-1",
      "imageId": "photo-1",
      "start": 7.05,
      "end": 16.68,
      "transition": {
        "type": "fade",
        "duration": 0.45
      },
      "motion": {
        "from": {
          "x": 0.5,
          "y": 0.5,
          "scale": 1.01
        },
        "to": {
          "x": 0.512,
          "y": 0.495,
          "scale": 1.045
        }
      },
      "hotspots": [
        {
          "id": "spot-1-1",
          "vocabularyId": "vocab-1-1",
          "label": "outdoor dining area",
          "x": 0.33,
          "y": 0.05,
          "width": 0.65,
          "height": 0.45,
          "utteranceIds": [
            "t8-50-u02"
          ]
        }
      ],
      "characters": [
        {
          "speaker": "M",
          "x": 0.01,
          "y": 0.03,
          "width": 0.3,
          "height": 0.9
        },
        {
          "speaker": "W2",
          "x": 0.31,
          "y": 0.03,
          "width": 0.28,
          "height": 0.9
        },
        {
          "speaker": "W1",
          "x": 0.64,
          "y": 0.03,
          "width": 0.34,
          "height": 0.9
        }
      ]
    },
    {
      "id": "scene-2",
      "imageId": "photo-2",
      "start": 16.68,
      "end": 27.93,
      "transition": {
        "type": "fade",
        "duration": 0.45
      },
      "motion": {
        "from": {
          "x": 0.5,
          "y": 0.5,
          "scale": 1.01
        },
        "to": {
          "x": 0.488,
          "y": 0.495,
          "scale": 1.045
        }
      },
      "hotspots": [
        {
          "id": "spot-2-1",
          "vocabularyId": "vocab-2-1",
          "label": "reserved",
          "x": 0.45,
          "y": 0.53,
          "width": 0.31,
          "height": 0.38,
          "utteranceIds": [
            "t8-50-u05"
          ]
        }
      ],
      "characters": [
        {
          "speaker": "M",
          "x": 0.01,
          "y": 0.03,
          "width": 0.3,
          "height": 0.9
        },
        {
          "speaker": "W2",
          "x": 0.31,
          "y": 0.03,
          "width": 0.34,
          "height": 0.9
        },
        {
          "speaker": "W1",
          "x": 0.7,
          "y": 0.03,
          "width": 0.29,
          "height": 0.9
        }
      ]
    },
    {
      "id": "scene-3",
      "imageId": "photo-3",
      "start": 27.93,
      "end": 40.56,
      "transition": {
        "type": "fade",
        "duration": 0.45
      },
      "motion": {
        "from": {
          "x": 0.5,
          "y": 0.5,
          "scale": 1.01
        },
        "to": {
          "x": 0.512,
          "y": 0.495,
          "scale": 1.045
        }
      },
      "hotspots": [],
      "characters": [
        {
          "speaker": "M",
          "x": 0.01,
          "y": 0.03,
          "width": 0.33,
          "height": 0.9
        },
        {
          "speaker": "W2",
          "x": 0.38,
          "y": 0.03,
          "width": 0.29,
          "height": 0.9
        },
        {
          "speaker": "W1",
          "x": 0.7,
          "y": 0.03,
          "width": 0.28,
          "height": 0.9
        }
      ]
    },
    {
      "id": "scene-4",
      "imageId": "photo-4",
      "start": 40.56,
      "end": 51.18,
      "transition": {
        "type": "fade",
        "duration": 0.45
      },
      "motion": {
        "from": {
          "x": 0.5,
          "y": 0.5,
          "scale": 1.01
        },
        "to": {
          "x": 0.488,
          "y": 0.495,
          "scale": 1.045
        }
      },
      "hotspots": [
        {
          "id": "spot-4-1",
          "vocabularyId": "vocab-4-1",
          "label": "reservation details",
          "x": 0.74,
          "y": 0.77,
          "width": 0.24,
          "height": 0.19,
          "utteranceIds": [
            "t8-50-u12"
          ]
        }
      ],
      "characters": [
        {
          "speaker": "M",
          "x": 0.01,
          "y": 0.03,
          "width": 0.38,
          "height": 0.9
        },
        {
          "speaker": "W1",
          "x": 0.41,
          "y": 0.03,
          "width": 0.3,
          "height": 0.9
        },
        {
          "speaker": "W2",
          "x": 0.73,
          "y": 0.03,
          "width": 0.26,
          "height": 0.9
        }
      ]
    }
  ],
  "vocabulary": [
    {
      "id": "vocab-1-1",
      "en": "outdoor dining area",
      "vi": "khu vực ăn uống ngoài trời",
      "pronunciation": {
        "kind": "tts",
        "lang": "en-US"
      }
    },
    {
      "id": "vocab-2-1",
      "en": "reserved",
      "vi": "đã đặt trước",
      "pronunciation": {
        "kind": "tts",
        "lang": "en-US"
      }
    },
    {
      "id": "vocab-4-1",
      "en": "reservation details",
      "vi": "thông tin đặt chỗ",
      "pronunciation": {
        "kind": "tts",
        "lang": "en-US"
      }
    }
  ],
  "speakers": [
    {
      "id": "M",
      "label": "Người nam",
      "portrait": {
        "imageId": "photo-1",
        "x": 0.04,
        "y": 0.05,
        "width": 0.24,
        "height": 0.42
      }
    },
    {
      "id": "W1",
      "label": "Người nữ",
      "portrait": {
        "imageId": "photo-1",
        "x": 0.69,
        "y": 0.05,
        "width": 0.24,
        "height": 0.42
      }
    },
    {
      "id": "W2",
      "label": "Người nữ",
      "portrait": {
        "imageId": "photo-1",
        "x": 0.33,
        "y": 0.05,
        "width": 0.24,
        "height": 0.42
      }
    }
  ],
  "missing": []
}
