{
  "$schema": "../scenes.schema.json",
  "schemaVersion": 1,
  "conversationId": "t5-50",
  "status": "ready",
  "enabled": true,
  "imagesApproved": true,
  "timingReviewed": true,
  "hotspotsReviewed": true,
  "audio": {
    "src": "../../audio/E26-T05-50-52.mp3",
    "timebase": "source-seconds",
    "dialogueStart": 5.82,
    "dialogueEnd": 39.18
  },
  "transcriptSrc": "transcript.json",
  "images": [
    {
      "id": "photo-1",
      "src": "images/scene-01.png",
      "alt": "Ảnh minh họa cảnh 1: budget discussion — thảo luận ngân sách",
      "mediaType": "photograph",
      "focalPoint": {
        "x": 0.5,
        "y": 0.5
      }
    },
    {
      "id": "photo-2",
      "src": "images/scene-02.png",
      "alt": "Ảnh minh họa cảnh 2: report — báo cáo",
      "mediaType": "photograph",
      "focalPoint": {
        "x": 0.5,
        "y": 0.5
      }
    },
    {
      "id": "photo-3",
      "src": "images/scene-03.png",
      "alt": "Ảnh minh họa cảnh 3: T-shirts — áo thun",
      "mediaType": "photograph",
      "focalPoint": {
        "x": 0.5,
        "y": 0.5
      }
    },
    {
      "id": "photo-4",
      "src": "images/scene-04.png",
      "alt": "Ảnh minh họa cảnh 4: inventory — hàng tồn kho",
      "mediaType": "photograph",
      "focalPoint": {
        "x": 0.5,
        "y": 0.5
      }
    }
  ],
  "scenes": [
    {
      "id": "scene-1",
      "imageId": "photo-1",
      "start": 5.82,
      "end": 14.46,
      "transition": {
        "type": "fade",
        "duration": 0.45
      },
      "motion": {
        "from": {
          "x": 0.5,
          "y": 0.5,
          "scale": 1.01
        },
        "to": {
          "x": 0.512,
          "y": 0.495,
          "scale": 1.045
        }
      },
      "hotspots": [
        {
          "id": "spot-1",
          "vocabularyId": "vocab-1",
          "label": "budget discussion",
          "x": 0.48,
          "y": 0.5,
          "width": 0.4,
          "height": 0.38,
          "utteranceIds": [
            "t5-50-u01"
          ]
        }
      ],
      "characters": [
        {
          "speaker": "M",
          "x": 0.02,
          "y": 0.05,
          "width": 0.46,
          "height": 0.87
        },
        {
          "speaker": "W",
          "x": 0.51,
          "y": 0.05,
          "width": 0.47,
          "height": 0.87
        }
      ]
    },
    {
      "id": "scene-2",
      "imageId": "photo-2",
      "start": 14.46,
      "end": 24.63,
      "transition": {
        "type": "fade",
        "duration": 0.45
      },
      "motion": {
        "from": {
          "x": 0.5,
          "y": 0.5,
          "scale": 1.01
        },
        "to": {
          "x": 0.488,
          "y": 0.495,
          "scale": 1.045
        }
      },
      "hotspots": [
        {
          "id": "spot-2",
          "vocabularyId": "vocab-2",
          "label": "report",
          "x": 0.42,
          "y": 0.58,
          "width": 0.37,
          "height": 0.3,
          "utteranceIds": [
            "t5-50-u03"
          ]
        }
      ],
      "characters": [
        {
          "speaker": "M",
          "x": 0.02,
          "y": 0.05,
          "width": 0.46,
          "height": 0.87
        },
        {
          "speaker": "W",
          "x": 0.51,
          "y": 0.05,
          "width": 0.47,
          "height": 0.87
        }
      ]
    },
    {
      "id": "scene-3",
      "imageId": "photo-3",
      "start": 24.63,
      "end": 29.28,
      "transition": {
        "type": "fade",
        "duration": 0.45
      },
      "motion": {
        "from": {
          "x": 0.5,
          "y": 0.5,
          "scale": 1.01
        },
        "to": {
          "x": 0.512,
          "y": 0.495,
          "scale": 1.045
        }
      },
      "hotspots": [
        {
          "id": "spot-3",
          "vocabularyId": "vocab-3",
          "label": "T-shirts",
          "x": 0.62,
          "y": 0.62,
          "width": 0.35,
          "height": 0.35,
          "utteranceIds": [
            "t5-50-u05"
          ]
        }
      ],
      "characters": [
        {
          "speaker": "M",
          "x": 0.02,
          "y": 0.05,
          "width": 0.46,
          "height": 0.87
        },
        {
          "speaker": "W",
          "x": 0.51,
          "y": 0.05,
          "width": 0.47,
          "height": 0.87
        }
      ]
    },
    {
      "id": "scene-4",
      "imageId": "photo-4",
      "start": 29.28,
      "end": 39.18,
      "transition": {
        "type": "fade",
        "duration": 0.45
      },
      "motion": {
        "from": {
          "x": 0.5,
          "y": 0.5,
          "scale": 1.01
        },
        "to": {
          "x": 0.488,
          "y": 0.495,
          "scale": 1.045
        }
      },
      "hotspots": [
        {
          "id": "spot-4",
          "vocabularyId": "vocab-4",
          "label": "inventory",
          "x": 0.6,
          "y": 0.34,
          "width": 0.38,
          "height": 0.6,
          "utteranceIds": [
            "t5-50-u07"
          ]
        }
      ],
      "characters": [
        {
          "speaker": "M",
          "x": 0.02,
          "y": 0.05,
          "width": 0.46,
          "height": 0.87
        },
        {
          "speaker": "W",
          "x": 0.51,
          "y": 0.05,
          "width": 0.47,
          "height": 0.87
        }
      ]
    }
  ],
  "vocabulary": [
    {
      "id": "vocab-1",
      "en": "budget discussion",
      "vi": "thảo luận ngân sách",
      "pronunciation": {
        "kind": "tts",
        "lang": "en-US"
      }
    },
    {
      "id": "vocab-2",
      "en": "report",
      "vi": "báo cáo",
      "pronunciation": {
        "kind": "tts",
        "lang": "en-US"
      }
    },
    {
      "id": "vocab-3",
      "en": "T-shirts",
      "vi": "áo thun",
      "pronunciation": {
        "kind": "tts",
        "lang": "en-US"
      }
    },
    {
      "id": "vocab-4",
      "en": "inventory",
      "vi": "hàng tồn kho",
      "pronunciation": {
        "kind": "tts",
        "lang": "en-US"
      }
    }
  ],
  "missing": [],
  "speakers": [
    {
      "id": "M",
      "label": "Người nam",
      "portrait": {
        "imageId": "photo-1",
        "x": 0.13,
        "y": 0.03666666666666668,
        "width": 0.24,
        "height": 0.42666666666666664
      }
    },
    {
      "id": "W",
      "label": "Người nữ",
      "portrait": {
        "imageId": "photo-1",
        "x": 0.625,
        "y": 0.03666666666666668,
        "width": 0.24,
        "height": 0.42666666666666664
      }
    }
  ],
  "speakerHighlightMethod": "Explicit per-photo cast regions; off-screen speakers are indicated in the speaker strip, never assigned to another visible person."
}
