{
  "$schema": "../scenes.schema.json",
  "schemaVersion": 1,
  "conversationId": "t4-44",
  "status": "ready",
  "enabled": true,
  "imagesApproved": true,
  "timingReviewed": true,
  "hotspotsReviewed": true,
  "audio": {
    "src": "../../audio/E26-T04-44-46.mp3",
    "timebase": "source-seconds",
    "dialogueStart": 6.12,
    "dialogueEnd": 41.43
  },
  "transcriptSrc": "transcript.json",
  "images": [
    {
      "id": "photo-1",
      "src": "images/scene-01.png",
      "alt": "Ảnh minh họa cảnh 1: reschedule — đổi lịch",
      "mediaType": "photograph",
      "focalPoint": {
        "x": 0.5,
        "y": 0.5
      }
    },
    {
      "id": "photo-2",
      "src": "images/scene-02.png",
      "alt": "Ảnh minh họa cảnh 2: on location — tại địa điểm quay phim",
      "mediaType": "photograph",
      "focalPoint": {
        "x": 0.5,
        "y": 0.5
      }
    },
    {
      "id": "photo-3",
      "src": "images/scene-03.png",
      "alt": "Ảnh minh họa cảnh 3: guest calendar — lịch khách mời",
      "mediaType": "photograph",
      "focalPoint": {
        "x": 0.5,
        "y": 0.5
      }
    },
    {
      "id": "photo-4",
      "src": "images/scene-04.png",
      "alt": "Ảnh minh họa cảnh 4: contract — hợp đồng",
      "mediaType": "photograph",
      "focalPoint": {
        "x": 0.5,
        "y": 0.5
      }
    }
  ],
  "scenes": [
    {
      "id": "scene-1",
      "imageId": "photo-1",
      "start": 6.12,
      "end": 13.2,
      "transition": {
        "type": "fade",
        "duration": 0.45
      },
      "motion": {
        "from": {
          "x": 0.5,
          "y": 0.5,
          "scale": 1.01
        },
        "to": {
          "x": 0.512,
          "y": 0.495,
          "scale": 1.045
        }
      },
      "hotspots": [
        {
          "id": "spot-1",
          "vocabularyId": "vocab-1",
          "label": "reschedule",
          "x": 0.44,
          "y": 0.62,
          "width": 0.4,
          "height": 0.3,
          "utteranceIds": [
            "t4-44-u01"
          ]
        }
      ],
      "characters": [
        {
          "speaker": "W",
          "x": 0.05,
          "y": 0.04,
          "width": 0.6,
          "height": 0.89
        }
      ]
    },
    {
      "id": "scene-2",
      "imageId": "photo-2",
      "start": 13.2,
      "end": 25.2,
      "transition": {
        "type": "fade",
        "duration": 0.45
      },
      "motion": {
        "from": {
          "x": 0.5,
          "y": 0.5,
          "scale": 1.01
        },
        "to": {
          "x": 0.488,
          "y": 0.495,
          "scale": 1.045
        }
      },
      "hotspots": [
        {
          "id": "spot-2",
          "vocabularyId": "vocab-2",
          "label": "on location",
          "x": 0.55,
          "y": 0.52,
          "width": 0.4,
          "height": 0.4,
          "utteranceIds": [
            "t4-44-u03"
          ]
        }
      ],
      "characters": [
        {
          "speaker": "W",
          "x": 0.05,
          "y": 0.04,
          "width": 0.6,
          "height": 0.89
        }
      ]
    },
    {
      "id": "scene-3",
      "imageId": "photo-3",
      "start": 25.2,
      "end": 34.59,
      "transition": {
        "type": "fade",
        "duration": 0.45
      },
      "motion": {
        "from": {
          "x": 0.5,
          "y": 0.5,
          "scale": 1.01
        },
        "to": {
          "x": 0.512,
          "y": 0.495,
          "scale": 1.045
        }
      },
      "hotspots": [
        {
          "id": "spot-3",
          "vocabularyId": "vocab-3",
          "label": "guest calendar",
          "x": 0.55,
          "y": 0.63,
          "width": 0.4,
          "height": 0.3,
          "utteranceIds": [
            "t4-44-u04"
          ]
        }
      ],
      "characters": [
        {
          "speaker": "M",
          "x": 0.05,
          "y": 0.04,
          "width": 0.6,
          "height": 0.89
        }
      ]
    },
    {
      "id": "scene-4",
      "imageId": "photo-4",
      "start": 34.59,
      "end": 41.43,
      "transition": {
        "type": "fade",
        "duration": 0.45
      },
      "motion": {
        "from": {
          "x": 0.5,
          "y": 0.5,
          "scale": 1.01
        },
        "to": {
          "x": 0.488,
          "y": 0.495,
          "scale": 1.045
        }
      },
      "hotspots": [
        {
          "id": "spot-4",
          "vocabularyId": "vocab-4",
          "label": "contract",
          "x": 0.42,
          "y": 0.64,
          "width": 0.4,
          "height": 0.31,
          "utteranceIds": [
            "t4-44-u07"
          ]
        }
      ],
      "characters": [
        {
          "speaker": "M",
          "x": 0.05,
          "y": 0.04,
          "width": 0.6,
          "height": 0.89
        }
      ]
    }
  ],
  "vocabulary": [
    {
      "id": "vocab-1",
      "en": "reschedule",
      "vi": "đổi lịch",
      "pronunciation": {
        "kind": "tts",
        "lang": "en-US"
      }
    },
    {
      "id": "vocab-2",
      "en": "on location",
      "vi": "tại địa điểm quay phim",
      "pronunciation": {
        "kind": "tts",
        "lang": "en-US"
      }
    },
    {
      "id": "vocab-3",
      "en": "guest calendar",
      "vi": "lịch khách mời",
      "pronunciation": {
        "kind": "tts",
        "lang": "en-US"
      }
    },
    {
      "id": "vocab-4",
      "en": "contract",
      "vi": "hợp đồng",
      "pronunciation": {
        "kind": "tts",
        "lang": "en-US"
      }
    }
  ],
  "missing": [],
  "speakers": [
    {
      "id": "W",
      "label": "Người nữ",
      "portrait": {
        "imageId": "photo-1",
        "x": 0.22999999999999998,
        "y": 0.03666666666666668,
        "width": 0.24,
        "height": 0.42666666666666664
      }
    },
    {
      "id": "M",
      "label": "Người nam",
      "portrait": {
        "imageId": "photo-3",
        "x": 0.22999999999999998,
        "y": 0.03666666666666668,
        "width": 0.24,
        "height": 0.42666666666666664
      }
    }
  ],
  "speakerHighlightMethod": "Explicit per-photo cast regions; off-screen speakers are indicated in the speaker strip, never assigned to another visible person."
}
